"id","chapter","title","content"
"8.4.2","§8.4.2","Derivation process for luma intra prediction mode","Input to this process is a luma location (xPb,yPb) specifying the top-left sample of the current luma prediction block relative to the top-left luma sample of the current picture. In this process, the luma intra prediction mode IntraPredModeY[xPb][yPb] is derived. Table8-14 specifies the value for the intra prediction mode and the associated names. Table8-14 - Specification of intra prediction mode and associated names Intra prediction mode Associated name INTRA_PLANAR INTRA_DC INTRA_ANGULAR2..INTRA_ANGULAR34 IntraPredModeY[xPb][yPb] labelled 0..34 represents directions of predictions as illustrated in Figure8-7. Figure8-7 - Intra prediction mode directions (informative) IntraPredModeY[xPb][yPb] is derived by the following ordered steps: 1. The neighbouring locations (xNbA,yNbA) and (xNbB,yNbB) are set equal to (xPb?1,yPb) and (xPb,yPb?1), respectively. 2. For X being replaced by either A or B, the variables candIntraPredModeX are derived as follows: - The availability derivation process for a block in z-scan order as specified in subclause6.4.1 is invoked with the location (xCurr,yCurr) set equal to (xPb,yPb) and the neighbouring location (xNbY,yNbY) set equal to (xNbX,yNbX) as inputs, and the output is assigned to availableX. - The candidate intra prediction mode candIntraPredModeX is derived as follows: - If availableX is equal to FALSE, candIntraPredModeX is set equal to INTRA_DC. - Otherwise, if CuPredMode[xNbX][yNbX] is not equal to MODE_INTRA or pcm_flag[xNbX][yNbX] is equal to 1, candIntraPredModeX is set equal to INTRA_DC, - Otherwise, if X is equal to B and yPb?1 is less than ((yPb>>CtbLog2SizeY)<<CtbLog2SizeY), candIntraPredModeB is set equal to INTRA_DC. - Otherwise, candIntraPredModeX is set equal to IntraPredModeY[xNbX][yNbX]. 3. The candModeList[x] with x=0..2 is derived as follows: - If candIntraPredModeB is equal to candIntraPredModeA, the following applies: ? If candIntraPredModeA is less than 2 (i.e. equal to INTRA_PLANAR or INTRA_DC), candModeList[x] with x=0..2 is derived as follows: candModeList[0] = INTRA_PLANAR	(8-108) candModeList[1] = INTRA_DC (8-109) candModeList[2] = INTRA_ANGULAR26	(8-110) ? Otherwise, candModeList[x] with x=0..2 is derived as follows: candModeList[0] = candIntraPredModeA	(8-111) candModeList[1] = 2+((candIntraPredModeA+29)%32)	(8-112) candModeList[2] = 2+((candIntraPredModeA?2+1)%32)	(8-113) - Otherwise (candIntraPredModeB is not equal to candIntraPredModeA), the following applies: ? candModeList[0] and candModeList[1] are derived as follows: candModeList[0] = candIntraPredModeA	(8-114) candModeList[1] = candIntraPredModeB	(8-115) ? If neither of candModeList[0] and candModeList[1] is equal to INTRA_PLANAR, candModeList[2] is set equal to INTRA_PLANAR, ? Otherwise, if neither of candModeList[0] and candModeList[1] is equal to INTRA_DC, candModeList[2] is set equal to INTRA_DC, ? Otherwise, candModeList[2] is set equal to INTRA_ANGULAR26. 4. IntraPredModeY[xPb][yPb] is derived by applying the following procedure: - If prev_intra_luma_pred_flag[xPb][yPb] is equal to 1, the IntraPredModeY[xPb][yPb] is set equal to candModeList[mpm_idx]. - Otherwise, IntraPredModeY[xPb][yPb] is derived by applying the following ordered steps: 1) The array candModeList[x], x=0..2 is modified as the following ordered steps: i. When candModeList[0] is greater than candModeList[1], both values are swapped as follows: (candModeList[0], candModeList[1]) = Swap(candModeList[0], candModeList[1])	(8-116) ii. When candModeList[0] is greater than candModeList[2], both values are swapped as follows: (candModeList[0], candModeList[2]) = Swap(candModeList[0], candModeList[2])	(8-117) iii. When candModeList[1] is greater than candModeList[2], both values are swapped as follows: (candModeList[1], candModeList[2])"
"8.4.3","§8.4.3","Derivation process for chroma intra prediction mode","Input to this process is a luma location (xCb,yCb) specifying the top-left sample of the current luma coding block relative to the top-left luma sample of the current picture. Output of this process is the variable IntraPredModeC. The chroma intra prediction mode IntraPredModeC is derived using intra_chroma_pred_mode[xCb][yCb] and IntraPredModeY[xCb][yCb] as specified in Table8-15. Table8-15 - Specification of IntraPredModeC intra_chroma_pred_mode[xCb][yCb] IntraPredModeY[xCb][yCb] X (0<=X<=34)"
"8.4.4.1","§8.4.4.1","General decoding process for intra blocks","Inputs to this process are: -	a sample location (xTb0,yTb0) specifying the top-left sample of the current transform block relative to the top-left sample of the current picture, -	a variable log2TrafoSize specifying the size of the current transform block, -	a variable trafoDepth specifying the hierarchy depth of the current block relative to the coding unit, -	a variable predModeIntra specifying the intra prediction mode, -	a variable cIdx specifying the colour component of the current block. Output of this process is a modified reconstructed picture before deblocking filtering. The luma sample location (xTbY,yTbY) specifying the top-left sample of the current luma transform block relative to the top-left luma sample of the current picture is derived as follows: (xTbY,yTbY)=(cIdx==0)?(xTb0,yTb0):(xTb0<<1,yTb0<<1)	(8-119) The variable splitFlag is derived as follows: -	If cIdx is equal to 0, splitFlag is set equal to split_transform_flag[xTbY][yTbY][trafoDepth]. -	Otherwise, if all of the following conditions are true, splitFlag is set equal to 1. - cIdx is greater than 0 - split_transform_flag[xTbY][yTbY][trafoDepth] is equal to 1 - log2TrafoSize is greater than 2 -	Otherwise, splitFlag is set equal to 0. Depending on the value of splitFlag, the following applies: -	If splitFlag is equal to 1, the following ordered steps apply: 1. The variables xTb1 and yTb1 are derived as follows: ? The variable xTb1 is set equal to xTb0+(1<<(log2TrafoSize?1)). ? The variable yTb1 is set equal to yTb0+(1<<(log2TrafoSize?1)). 2. The general decoding process for intra blocks as specified in this subclause is invoked with the location (xTb0,yTb0), the variable log2TrafoSize set equal to log2TrafoSize?1, the variable trafoDepth set equal to trafoDepth+1, the intra prediction mode predModeIntra, and the variable cIdx as inputs, and the output is a modified reconstructed picture before deblocking filtering. 3. The general decoding process for intra blocks as specified in this subclause is invoked with the location (xTb1,yTb0), the variable log2TrafoSize set equal to log2TrafoSize?1, the variable trafoDepth set equal to trafoDepth+1, the intra prediction mode predModeIntra, and the variable cIdx as inputs, and the output is a modified reconstructed picture before deblocking filtering. 4. The general decoding process for intra blocks as specified in this subclause is invoked with the location (xTb0,yTb1), the variable log2TrafoSize set equal to log2TrafoSize?1, the variable trafoDepth set equal to trafoDepth+1, the intra prediction mode predModeIntra, and the variable cIdx as inputs, and the output is a modified reconstructed picture before deblocking filtering. 5. The general decoding process for intra blocks as specified in this subclause is invoked with the location (xTb1,yTb1), the variable log2TrafoSize set equal to log2TrafoSize?1, the variable trafoDepth set equal to trafoDepth+1, the intra prediction mode predModeIntra, and the variable cIdx as inputs, and the output is a modified reconstructed picture before deblocking filtering. -	Otherwise (splitFlag is equal to 0), the following ordered steps apply: 1. The variable nTbS is set equal to 1<<log2TrafoSize. 2. The general intra sample prediction process as specified in subclause 8.4.4.2.1 is invoked with the transform block location (xTb0,yTb0), the intra prediction mode predModeIntra, the transform block size nTbS, and the variable cIdx as inputs, and the output is an (nTbS)x(nTbS) array predSamples. 3. The scaling and transformation process as specified in subclause 8.6.2 is invoked with the luma location (xTbY,yTbY), the variable trafoDepth, the variable cIdx, and the transform size trafoSize set equal to nTbS as inputs, and the output is an (nTbS)x(nTbS) array resSamples. 4. The picture reconstruction process prior to in-loop filtering for a colour component as specified in subcl"
"8.4.4.2.1","§8.4.4.2.1","General intra sample prediction","Inputs to this process are: -	a sample location (xTbCmp,yTbCmp) specifying the top-left sample of the current transform block relative to the top-left sample of the current picture, -	a variable predModeIntra specifying the intra prediction mode, -	a variable nTbS specifying the transform block size, -	a variable cIdx specifying the colour component of the current block. Output of this process is the predicted samples predSamples[x][y], with x,y=0..nTbS?1. The nTbS*4+1 neighbouring samples p[x][y] that are constructed samples prior to the deblocking filter process, with x=?1,y=?1..nTbS*2?1 and x=0..nTbS*2?1,y=?1, are derived as follows: -	The neighbouring location (xNbCmp,yNbCmp) is specified by: (xNbCmp,yNbCmp)=(xTbCmp+x,yTbCmp+y)	(8-120) - The current luma location (xTbY,yTbY) and the neighbouring luma location (xNbY,yNbY) are derived as follows: (xTbY,yTbY)=(cIdx==0)?(xTbCmp,yTbCmp):(xTbCmp<<1,yTbCmp<<1)	(8-121) (xNbY,yNbY)=(cIdx==0)?(xNbCmp,yNbCmp):(xNbCmp<<1,yNbCmp<<1)	(8-122) - The availability derivation process for a block in z-scan order as specified in subclause6.4.1 is invoked with the current luma location (xCurr,yCurr) set equal to (xTbY,yTbY) and the neighbouring luma location (xNbY,yNbY) as inputs, and the output is assigned to availableN. -	Each sample p[x][y] is derived as follows: - If one or more of the following conditions are true, the sample p[x][y] is marked as ""not available for intra prediction"": ? The variable availableN is equal to FALSE. ? CuPredMode[xNbY][yNbY] is not equal to MODE_INTRA and constrained_intra_pred_flag is equal to1. - Otherwise, the sample p[x][y] is marked as ""available for intra prediction"" and the sample at the location (xNbCmp,yNbCmp) is assigned to p[x][y]. When at least one sample p[x][y] with x=?1, y=?1..nTbS*2?1 and x=0..nTbS*2?1, y=?1 is marked as ""not available for intra prediction"", the reference sample substitution process for intra sample prediction in subclause 8.4.4.2.2 is invoked with the samples p[x][y] with x=?1, y=?1..nTbS*2?1 and x=0..nTbS*2?1, y=?1, nTbS, and cIdx as inputs, and the modified samples p[x][y] with x=?1, y=?1..nTbS*2?1 and x=0..nTbS*2?1, y=?1 as output. Depending on the value of predModeIntra, the following ordered steps apply: 1. When cIdx is equal to 0, the filtering process of neighbouring samples specified in subclause8.4.4.2.3 is invoked with the sample array p and the transform block size nTbS as inputs, and the output is reassigned to the sample array p. 2. The intra sample prediction process according to predModeIntra applies as follows: ? If predModeIntra is equal to INTRA_PLANAR, the corresponding intra prediction mode specified in subclause8.4.4.2.4 is invoked with the sample array p and the transform block size nTbS as inputs, and the output is the predicted sample array predSamples. ? Otherwise, if predModeIntra is equal to INTRA_DC, the corresponding intra prediction mode specified in subclause8.4.4.2.5 is invoked with the sample array p, the transform block size nTbS, and the colour component index cIdx as inputs, and the output is the predicted sample array predSamples. ? Otherwise (predModeIntra is in the range of INTRA_ANGULAR2..INTRA_ANGULAR34), the corresponding intra prediction mode specified in subclause 8.4.4.2.6 is invoked with the intra prediction mode predModeIntra, the sample array p, the transform block size nTbS, and the colour component index cIdx as inputs, and the output is the predicted sample array predSamples."
"8.4.4.2.2","§8.4.4.2.2","Reference sample substitution process for intra sample prediction","Inputs to this process are: - reference samples p[x][y] with x=?1,y=?1..nTbS*2?1 and x=0..nTbS*2?1, y=?1 for intra sample prediction, - a transform block size nTbS, - a variable cIdx specifying the colour component of the current block. Outputs of this process are the modified reference samples p[x][y] with x=?1,y=?1..nTbS*2?1 and x=0..nTbS*2?1, y=?1 for intra sample prediction. The variable bitDepth is derived as follows: -	If cIdx is equal to 0, bitDepth is set equal to BitDepthY. -	Otherwise, bitDepth is set equal to BitDepthC. The values of the samples p[x][y] with x=?1,y=?1..nTbS*2?1 and x=0..nTbS*2?1, y=?1 are modified as follows: - If all samples p[x][y] with x=?1,y=?1..nTbS*2?1 and x=0..nTbS*2?1, y=?1 are marked as ""not available for intra prediction"", the value 1<<(bitDepth?1) is substituted for the values of all samples p[x][y]. - Otherwise (at least one but not all samples p[x][y] are marked as ""not available for intra prediction""), the following ordered steps are performed: 1. When p[?1][nTbS*2?1] is marked as ""not available for intra prediction"", search sequentially starting from x=?1, y=nTbS*2?1 to x=?1, y=?1, then from x=0, y=?1 to x=nTbS*2?1, y=?1. Once a sample p[x][y] marked as ""available for intra prediction"" is found, the search is terminated and the value of p[x][y] is assigned to p[?1][nTbS*2?1]. 2. Search sequentially starting from x=?1, y=nTbS*2?2 to x=?1, y=?1, when p[x][y] is marked as ""not available for intra prediction"", the value of p[x][y+1] is substituted for the value of p[x][y]. 3. For x=0..nTbS*2?1, y=?1, when p[x][y] is marked as ""not available for intra prediction"", the value of p[x?1][y] is substituted for the value of p[x][y]. All samples p[x][y] with x=?1,y=?1..nTbS*2?1 and x=0..nTbS*2?1, y=?1 are marked as ""available for intra prediction""."
"8.4.4.2.3","§8.4.4.2.3","Filtering process of neighbouring samples","Inputs to this process are: -	the neighbouring samples p[x][y], with x=?1,y=?1..nTbS*2?1 and x=0..nTbS*2?1,y=?1, -	a variable nTbS specifying the transform block size. Outputs of this process are the filtered samples pF[x][y], with x=?1,y=?1..nTbS*2?1 and x=0..nTbS*2?1,y=?1. The variable filterFlag is derived as follows: -	If one or more of the following conditions are true, filterFlag is set equal to 0: - predModeIntra is equal to INTRA_DC. - nTbS is equal 4. -	Otherwise, the following applies: - The variable minDistVerHor is set equal to Min(Abs(predModeIntra?26),Abs(predModeIntra?10)). - The variable intraHorVerDistThres[nTbS] is specified in Table8-16. - The variable filterFlag is derived as follows: - If minDistVerHor is greater than intraHorVerDistThres[nTbS], filterFlag is set equal to 1. - Otherwise, filterFlag is set equal to 0. Table8-16 - Specification of intraHorVerDistThres[nTbS] for various transform block sizes nTbS=8 nTbS=16 nTbS=32 intraHorVerDistThres[nTbS] When filterFlag is equal to 1, the following applies: -	The variable biIntFlag is derived as follows: -	If all of the following conditions are true, biIntFlag is set equal to 1: - strong_intra_smoothing_enabled_flag is equal to 1 - nTbS is equal to 32 - Abs(p[?1][?1]+p[nTbS*2?1][?1]-2*p[nTbS?1][?1])<(1<<(BitDepthY?5)) - Abs(p[?1][?1]+p[?1][nTbS*2?1]-2*p[?1][nTbS?1])<(1<<(BitDepthY?5)) -	Otherwise, biIntFlag is set equal to 0. -	The filtering is performed as follows: -	If biIntFlag is equal to 1, the filtered sample values pF[x][y] with x=?1,y=?1..63 and x=0..63,y=?1 are derived as follows: pF[?1][?1]=p[?1][?1] (8-123) pF[?1][y]=((63?y)*p[?1][?1]+(y+1)*p[?1][63]+32)>>6 for y=0..62	(8-124) pF[?1][63]=p[?1][63] (8-125) pF[x][?1]=((63?x)*p[?1][?1]+(x+1)*p[63][?1]+32)>>6 for x=0..62	(8-126) pF[63][?1]=p[63][?1] (8-127) -	Otherwise (biIntFlag is equal to 0), the filtered sample values pF[x][y] with x=?1,y=?1..nTbS*2?1 and x=0..nTbS*2?1,y=?1 are derived as follows: pF[?1][?1] = (p[?1][0]+2*p[?1][?1]+p[0][?1]+2)>>2	(8-128) pF[?1][y] = (p[?1][y+1]+2*p[?1][y]+p[?1][y?1]+2)>>2 for y=0..nTbS*2?2	(8-129) pF[?1][nTbS*2?1] = p[?1][nTbS*2?1] (8-130) pF[x][?1] = (p[x?1][?1]+2*p[x][?1]+p[x+1][?1]+2)>>2 for x=0..nTbS*2?2	(8-131) pF[nTbS*2?1][?1] = p[nTbS*2?1][?1] (8-132)"
"8.4.4.2.4","§8.4.4.2.4","Specification of intra prediction mode INTRA_PLANAR","Inputs to this process are: -	the neighbouring samples p[x][y], with x=?1,y=?1..nTbS*2?1 and x=0..nTbS*2?1,y=?1, -	a variable nTbS specifying the transform block size. Outputs of this process are the predicted samples predSamples[x][y], with x,y=0..nTbS?1. The values of the prediction samples predSamples[x][y], with x,y=0..nTbS?1, are derived as follows: predSamples[x][y] = ((nTbS?1?x)*p[?1][y]+(x+1)*p[nTbS][?1]+ (nTbS?1?y)*p[x][?1]+ (y+1)*p[?1][nTbS]+nTbS)>>(Log2(nTbS)+1)	(8-133)"
"8.4.4.2.5","§8.4.4.2.5","Specification of intra prediction mode INTRA_DC","Inputs to this process are: -	the neighbouring samples p[x][y], with x=?1,y=?1..nTbS*2?1 and x=0..nTbS*2?1,y=?1, -	a variable nTbS specifying the transform block size, -	a variable cIdx specifying the colour component of the current block. Outputs of this process are the predicted samples predSamples[x][y], with x,y=0..nTbS?1. The values of the prediction samples predSamples[x][y], with x,y=0..nTbS?1, are derived by the following ordered steps: 1. A variable dcVal is derived as follows: dcVal = (8-134) where k = Log2(nTbS). 2. Depending on the value of the colour component index cIdx, the following applies: - If cIdx is equal to 0 and nTbS is less than 32, the following applies: predSamples[0][0] = (p[?1][0]+2*dcVal+p[0][?1]+2)>>2	(8-135) predSamples[x][0] = (p[x][?1]+3*dcVal+2)>>2, with x=1..nTbS?1	(8-136) predSamples[0][y] = (p[?1][y]+3*dcVal+2)>>2, with y=1..nTbS?1	(8-137) predSamples[x][y] = dcVal, with x,y=1..nTbS?1	(8-138) - Otherwise, the prediction samples predSamples[x][y] are derived as follows: predSamples[x][y] = dcVal, with x,y=0..nTbS?1	(8-139)"
"8.4.4.2.6","§8.4.4.2.6","Specification of intra prediction mode in the range of INTRA_ANGULAR2.. INTRA_ANGULAR34","Inputs to this process are: -	the intra prediction mode predModeIntra, -	the neighbouring samples p[x][y], with x=?1,y=?1..nTbS*2?1 and x=0..nTbS*2?1,y=?1, -	a variable nTbS specifying the transform block size, -	a variable cIdx specifying the colour component of the current block. Outputs of this process are the predicted samples predSamples[x][y], with x,y=0..nTbS?1. Figure8-8 illustrates the total 33 intra angles and Table8-17 specifies the mapping table between predModeIntra and the angle parameter intraPredAngle. Figure8-8 - Intra prediction angle definition (informative) Table8-17 - Specification of intraPredAngle predModeIntra intraPredAngle predModeIntra intraPredAngle Table8-18 further specifies the mapping table between predModeIntra and the inverse angle parameter invAngle. Table8-18 - Specification of invAngle predModeIntra invAngle predModeIntra invAngle The values of the prediction samples predSamples[x][y], with x,y=0..nTbS?1 are derived as follows: -	If predModeIntra is equal or greater than 18, the following ordered steps apply: 1. The reference sample array ref[x] is specified as follows: - The following applies: ref[x] = p[?1+x][?1], with x=0..nTbS	(8-140) - If intraPredAngle is less than 0, the main reference sample array is extended as follows: - When (nTbS*intraPredAngle)>>5 is less than ?1, ref[x] = p[?1][?1+((x*invAngle+128)>>8)], with x=?1..(nTbS*intraPredAngle)>>5	(8-141) - Otherwise, ref[x] = p[?1+x][?1], with x = nTbS+1..2*nTbS	(8-142) 2. The values of the prediction samples predSamples[x][y], with x,y=0..nTbS?1 are derived as follows: a. The index variable iIdx and the multiplication factor iFact are derived as follows: iIdx = ((y+1)*intraPredAngle)>>5 (8-143) iFact = ((y+1)*intraPredAngle)&31 (8-144) b. Depending on the value of iFact, the following applies: - If iFact is not equal to 0, the value of the prediction samples predSamples[x][y] is derived as follows: predSamples[x][y] = ((32?iFact)*ref[x+iIdx+1]+iFact*ref[x+iIdx+2]+16)>>5	(8-145) - Otherwise, the value of the prediction samples predSamples[x][y] is derived as follows: predSamples[x][y] = ref[x+iIdx+1] (8-146) c. When predModeIntra is equal to 26 (vertical), cIdx is equal to 0 and nTbS is less than 32, the following filtering applies with x=0,y=0..nTbS?1: predSamples[x][y] = Clip1Y(p[x][?1]+((p[?1][y]?p[?1][?1])>>1))	(8-147) -	Otherwise (predModeIntra is less than 18), the following ordered steps apply: 1. The reference sample array ref[x] is specified as follows: - The following applies: ref[x] = p[?1][?1+x], with x=0..nTbS	(8-148) - If intraPredAngle is less than 0, the main reference sample array is extended as follows: - When (nTbS*intraPredAngle)>>5 is less than ?1, ref[x] = p[?1+((x*invAngle+128)>>8)][?1], with x=?1..(nTbS*intraPredAngle)>>5	(8-149) - Otherwise, ref[x] = p[?1][?1+x], with x=nTbS+1..2*nTbS	(8-150) 2. The values of the prediction samples predSamples[x][y], with x,y=0..nTbS?1 are derived as follows: a. The index variable iIdx and the multiplication factor iFact are derived as follows: iIdx = ((x+1)*intraPredAngle)>>5 (8-151) iFact = ((x+1)*intraPredAngle)&31 (8-152) b. Depending on the value of iFact, the following applies: - If iFact is not equal to 0, the value of the prediction samples predSamples[x][y] is derived as follows: predSamples[x][y] = ((32?iFact)*ref[y+iIdx+1]+iFact*ref[y+iIdx+2]+16)>>5	(8-153) - Otherwise, the value of the prediction samples predSamples[x][y] is derived as follows: predSamples[x][y] = ref[y+iIdx+1] (8-154) c. When predModeIntra is equal to 10 (horizontal), cIdx is equal to 0 and nTbS is less than 32, the follow"
"8.5.1","§8.5.1","General decoding process for coding units coded in inter prediction mode","Inputs to this process are: -	a luma location (xCb, yCb) specifying the top-left sample of the current luma coding block relative to the top-left luma sample of the current picture, -	a variable log2CbSize specifying the size of the current coding block. Output of this process is a modified reconstructed picture before deblocking filtering. The derivation process for quantization parameters as specified in subclause 8.6.1 is invoked with the luma location (xCb,yCb) as input. The variable nCbSL is set equal to 1<<log2CbSize and the variable nCbSC is set equal to 1<<(log2CbSize?1). The decoding process for coding units coded in inter prediction mode consists of following ordered steps: 1. The inter prediction process as specified in subclause 8.5.2 is invoked with the luma location (xCb,yCb) and the luma coding block size log2CbSize as inputs, and the outputs are three arrays predSamplesL, predSamplesCb, and predSamplesCr. 2. The decoding process for the residual signal of coding units coded in inter prediction mode specified in subclause 8.5.4 is invoked with the luma location (xCb,yCb) and the luma coding block size log2CbSize as inputs, and the outputs are three arrays resSamplesL, resSamplesCb, and resSamplesCr. 3. The reconstructed samples of the current coding unit are derived as follows: -	The picture reconstruction process prior to in-loop filtering for a colour component as specified in subclause8.6.5 is invoked with the luma coding block location (xCb,yCb), the variable nCurrS set equal to nCbSL, the variable cIdx set equal to 0, the (nCbSL)x(nCbSL) array predSamples set equal to predSamplesL, and the (nCbSL)x(nCbSL) array resSamples set equal to resSamplesL as inputs. -	The picture reconstruction process prior to in-loop filtering for a colour component as specified in subclause8.6.5 is invoked with the chroma coding block location (xCb/2,yCb/2), the variable nCurrS set equal to nCbSC, the variable cIdx set equal to 1, the (nCbSC)x(nCbSC) array predSamples set equal to predSamplesCb, and the (nCbSC)x(nCbSC) array resSamples set equal to resSamplesCb as inputs. -	The picture reconstruction process prior to in-loop filtering for a colour component as specified in subclause8.6.5 is invoked with the chroma coding block location (xCb/2,yCb/2), the variable nCurrS set equal to nCbSC, the variable cIdx set equal to 2, the (nCbSC)x(nCbSC) array predSamples set equal to predSamplesCr, and the (nCbSC)x(nCbSC) array resSamples set equal to resSamplesCr as inputs."
