"id","chapter","title","content"
"7.4.2.2","§7.4.2.2","NAL unit header semantics","forbidden_zero_bit shall be equal to 0. nal_unit_type specifies the type of RBSP data structure contained in the NAL unit as specified in Table7-3. NAL units that have nal_unit_type in the range of UNSPEC48..UNSPEC63, inclusive, for which semantics are not specified, shall not affect the decoding process specified in this Specification. NOTE32-NAL unit types in the range of UNSPEC48..UNSPEC63 may be used as determined by the application. No decoding process for these values of nal_unit_type is specified in this Specification. Since different applications might use these NAL unit types for different purposes, particular care must be exercised in the design of encoders that generate NAL units with these nal_unit_type values, and in the design of decoders that interpret the content of NAL units with these nal_unit_type values. For purposes other than determining the amount of data in the decoding units of the bitstream (as specified in AnnexC), decoders shall ignore (remove from the bitstream and discard) the contents of all NAL units that use reserved values of nal_unit_type. NOTE33-This requirement allows future definition of compatible extensions to this Specification. Table7-3 - NAL unit type codes and NAL unit type classes nal_unit_type Name of nal_unit_type Content of NAL unit and RBSP syntax structure NAL unit type class TRAIL_N TRAIL_R Coded slice segment of a non-TSA, non-STSA trailing picture slice_segment_layer_rbsp Coded slice segment of a TSA picture slice_segment_layer_rbsp STSA_N STSA_R Coded slice segment of an STSA picture slice_segment_layer_rbsp RADL_N RADL_R Coded slice segment of a RADL picture slice_segment_layer_rbsp RASL_N RASL_R Coded slice segment of a RASL picture slice_segment_layer_rbsp RSV_VCL_N10 RSV_VCL_N12 RSV_VCL_N14 Reserved non-IRAP sub-layer non-reference VCL NAL unit types RSV_VCL_R11 RSV_VCL_R13 RSV_VCL_R15 Reserved non-IRAP sub-layer reference VCL NAL unit types BLA_W_LP BLA_W_RADL BLA_N_LP Coded slice segment of a BLA picture slice_segment_layer_rbsp IDR_W_RADL IDR_N_LP Coded slice segment of an IDR picture slice_segment_layer_rbsp CRA_NUT Coded slice segment of a CRA picture slice_segment_layer_rbsp RSV_IRAP_VCL22 RSV_IRAP_VCL23 Reserved IRAP VCL NAL unit types 24..31 RSV_VCL24.. RSV_VCL31 Reserved non-IRAP VCL NAL unit types VPS_NUT Video parameter set video_parameter_set_rbsp non-VCL SPS_NUT Sequence parameter set seq_parameter_set_rbsp non-VCL PPS_NUT Picture parameter set pic_parameter_set_rbsp non-VCL AUD_NUT Access unit delimiter access_unit_delimiter_rbsp non-VCL EOS_NUT End of sequence end_of_seq_rbsp non-VCL EOB_NUT End of bitstream end_of_bitstream_rbsp non-VCL FD_NUT Filler data filler_data_rbsp non-VCL PREFIX_SEI_NUT SUFFIX_SEI_NUT Supplemental enhancement information sei_rbsp non-VCL 41..47 RSV_NVCL41.. RSV_NVCL47 Reserved non-VCL 48..63 UNSPEC48.. UNSPEC63 Unspecified non-VCL NOTE34-A CRA picture may have associated RASL or RADL pictures present in the bitstream. NOTE35-A BLA picture having nal_unit_type equal to BLA_W_LP may have associated RASL or RADL pictures present in the bitstream. A BLA picture having nal_unit_type equal to BLA_W_RADL does not have associated RASL pictures present in the bitstream, but may have associated RADL pictures in the bitstream. A BLA picture having nal_unit_type equal to BLA_N_LP does not have associated leading pictures present in the bitstream. NOTE36-An IDR picture having nal_unit_type equal to IDR_N_LP does not have associated leading pictures present in the bitstream. An IDR picture having nal_unit_type equal to IDR_W_RADL does not have associated RASL pictures present in the bitstream, but may have associated RADL pictures in the bitstream. NOTE37-A sub-layer non-reference picture is not included in any of RefPicSetStCurrBefore, RefPicSetStCurrAfter and RefPicSetLtCurr of any picture with the same value of TemporalId, and may be discarded without affecting the decodab"
"7.4.2.3","§7.4.2.3","Encapsulation of an SODB within an RBSP (informative)","This subclause does not form an integral part of this Specification. The form of encapsulation of an SODB within an RBSP and the use of the emulation_prevention_three_byte for encapsulation of an RBSP within a NAL unit is described for the following purposes: -	To prevent the emulation of start codes within NAL units while allowing any arbitrary SODB to be represented within a NAL unit, -	To enable identification of the end of the SODB within the NAL unit by searching the RBSP for the rbsp_stop_one_bit starting at the end of the RBSP, -	To enable a NAL unit to have a size greater than that of the SODB under some circumstances (using one or more cabac_zero_word syntax elements). The encoder can produce a NAL unit from an RBSP by the following procedure: 1. The RBSP data are searched for byte-aligned bits of the following binary patterns: '0000000000000000000000xx' (where 'xx' represents any two-bit pattern: '00', '01', '10', or '11'), and a byte equal to 0x03 is inserted to replace the bit pattern with the pattern: '000000000000000000000011000000xx', and finally, when the last byte of the RBSP data is equal to 0x00 (which can only occur when the RBSP ends in a cabac_zero_word), a final byte equal to 0x03 is appended to the end of the data. The last zero byte of a byte-aligned three-byte sequence 0x000000 in the RBSP (which is replaced by the four-byte sequence 0x00000300) is taken into account when searching the RBSP data for the next occurrence of byte-aligned bits with the binary patterns specified above. 2. The resulting sequence of bytes is then prefixed with the NAL unit header, within which the nal_unit_type indicates the type of RBSP data structure in the NAL unit. The process specified above results in the construction of the entire NAL unit. This process can allow any SODB to be represented in a NAL unit while ensuring both of the following: -	No byte-aligned start code prefix is emulated within the NAL unit. - No sequence of 8 zero-valued bits followed by a start code prefix, regardless of byte-alignment, is emulated within the NAL unit."
"7.4.2.4.1","§7.4.2.4.1","General","This subclause specifies constraints on the order of NAL units in the bitstream. Any order of NAL units in the bitstream obeying these constraints is referred to in the text as the decoding order of NAL units. Within a NAL unit, the syntax in subclauses7.3, D.2, and D.1 specifies the decoding order of syntax elements. Decoders shall be capable of receiving NAL units and their syntax elements in decoding order."
"7.4.2.4.2","§7.4.2.4.2","Order of VPS, SPS and PPS RBSPs and their activation","This subclause specifies the activation process of VPSs, SPSs, and PPSs. NOTE41-The VPS, SPS, and PPS mechanism decouples the transmission of infrequently changing information from the transmission of coded block data. VPSs, SPSs, and PPSs may, in some applications, be conveyed ""out-of-band"". A PPS RBSP includes parameters that can be referred to by the coded slice segment NAL units of one or more coded pictures. Each PPS RBSP is initially considered not active at the start of the operation of the decoding process. At most one PPS RBSP is considered active at any given moment during the operation of the decoding process, and the activation of any particular PPS RBSP results in the deactivation of the previously-active PPS RBSP (if any). When a PPS RBSP (with a particular value of pps_pic_parameter_set_id) is not active and it is referred to by a coded slice segment NAL unit (using a value of slice_pic_parameter_set_id equal to the pps_pic_parameter_set_id value), it is activated. This PPS RBSP is called the active PPS RBSP until it is deactivated by the activation of another PPS RBSP. A PPS RBSP, with that particular value of pps_pic_parameter_set_id, shall be available to the decoding process prior to its activation, included in at least one access unit with TemporalId less than or equal to the TemporalId of the PPS NAL unit or provided through external means. Any PPS NAL unit containing the value of pps_pic_parameter_set_id for the active PPS RBSP for a coded picture shall have the same content as that of the active PPS RBSP for the coded picture, unless it follows the last VCL NAL unit of the coded picture and precedes the first VCL NAL unit of another coded picture. An SPS RBSP includes parameters that can be referred to by one or more PPS RBSPs or one or more SEI NAL units containing an active parameter sets SEI message. Each SPS RBSP is initially considered not active at the start of the operation of the decoding process. At most one SPS RBSP is considered active at any given moment during the operation of the decoding process, and the activation of any particular SPS RBSP results in the deactivation of the previously-active SPS RBSP (if any). When an SPS RBSP (with a particular value of sps_seq_parameter_set_id) is not already active and it is referred to by activation of a PPS RBSP (in which pps_seq_parameter_set_id is equal to the sps_seq_parameter_set_id value) or is referred to by an SEI NAL unit containing an active parameter sets SEI message (in which active_seq_parameter_set_id[0] is equal to the sps_seq_parameter_set_id value), it is activated. This SPS RBSP is called the active SPS RBSP until it is deactivated by the activation of another SPS RBSP. An SPS RBSP, with that particular value of sps_seq_parameter_set_id, shall be available to the decoding process prior to its activation, included in at least one access unit with TemporalId equal to 0 or provided through external means. An activated SPS RBSP shall remain active for the entire CVS. NOTE42-Because an IRAP access unit with NoRaslOutputFlag equal to 1 begins a new CVS and an activated SPS RBSP must remain active for the entire CVS, an SPS RBSP can only be activated by an active parameter sets SEI message when the active parameter sets SEI message is part of an IRAP access unit with NoRaslOutputFlag equal to 1. Any SPS NAL unit containing the value of sps_seq_parameter_set_id for the active SPS RBSP for a CVS shall have the same content as that of the active SPS RBSP for the CVS, unless it follows the last access unit of the CVS and precedes the first VCL NAL unit and the first SEI NAL unit containing an active parameter sets SEI message (when present) of another CVS. A VPS RBSP includes parameters that can be referred to by one or more SPS RBSPs or one or more SEI NAL units containing an active parameter sets SEI message. Each VPS RBSP is initially considered not active at the start of the operation of the decoding process. At most one VPS RBSP i"
"7.4.2.4.3","§7.4.2.4.3","Order of access units and association to CVSs","A bitstream conforming to this Specification consists of one or more CVSs. A CVS consists of one or more access units. The order of NAL units and coded pictures and their association to access units is described in subclause7.4.2.4.4. The first access unit of a CVS is an IRAP access unit with NoRaslOutputFlag equal to 1. It is a requirement of bitstream conformance that, when present, the next access unit after an access unit that contains an end of sequence NAL unit or an end of bitstream NAL unit shall be an IRAP access unit, which may be an IDR access unit, a BLA access unit, or a CRA access unit."
"7.4.2.4.4","§7.4.2.4.4","Order of NAL units and coded pictures and their association to access units","This subclause specifies the order of NAL units and coded pictures and their association to access unit for CVSs that conform to one or more of the profiles specified in AnnexA that are decoded using the decoding process specified in clauses2 through 10. An access unit consists of one coded picture and zero or more non-VCL NAL units. The association of VCL NAL units to coded pictures is described in subclause7.4.2.4.5. The first access unit in the bitstream starts with the first NAL unit of the bitstream. The first of any of the following NAL units after the last VCL NAL unit of a coded picture specifies the start of a new access unit: -	access unit delimiter NAL unit (when present), -	VPS NAL unit (when present), -	SPS NAL unit (when present), -	PPS NAL unit (when present), -	Prefix SEI NAL unit (when present), -	NAL units with nal_unit_type in the range of RSV_NVCL41..RSV_NVCL44 (when present), -	NAL units with nal_unit_type in the range of UNSPEC48..UNSPEC55 (when present), -	first VCL NAL unit of a coded picture (always present). The order of the coded pictures and non-VCL NAL units within an access unit shall obey the following constraints: -	When an access unit delimiter NAL unit is present, it shall be the first NAL unit. There shall be at most one access unit delimiter NAL unit in any access unit. -	When any prefix SEI NAL units are present, they shall not follow the last VCL NAL unit of the access unit. -	NAL units having nal_unit_type equal to FD_NUT or SUFFIX_SEI_NUT, or in the range of RSV_NVCL45..RSV_NVCL47 or UNSPEC56..UNSPEC63 shall not precede the first VCL NAL unit of the coded picture. -	When an end of sequence NAL unit is present, it shall be the last NAL unit in the access unit other than an end of bitstream NAL unit (when present). -	When an end of bitstream NAL unit is present, it shall be the last NAL unit in the access unit. NOTE-VPS NAL units, SPS NAL units, PPS NAL units, prefix SEI NAL units, or NAL units with nal_unit_type in the range of RSV_NVCL41..RSV_NVCL44 or UNSPEC48..UNSPEC55, may be present in an access unit, but cannot follow the last VCL NAL unit of the coded picture within the access unit, as this condition would specify the start of a new access unit. The structure of access units not containing any NAL units with nal_unit_type equal to FD_NUT, VPS_NUT, SPS_NUT, PPS_NUT, RSV_VCL_N10, RSV_VCL_R11, RSV_VCL_N12, RSV_VCL_R13, RSV_VCL_N14, or RSV_VCL_R15, RSV_IRAP_VCL22, or RSV_IRAP_VCL23, or in the range of RSV_VCL24..RSV_VCL31, RSV_NVCL41..RSV_NVCL47, or UNSPEC48..UNSPEC63 is shown in Figure7-6. Figure7-6 - Structure of an access unit not containing any NAL units with nal_unit_type equal to FD_NUT, SUFFIX_SEI_NUT, VPS_NUT, SPS_NUT, PPS_NUT, RSV_VCL_N10, RSV_VCL_R11, RSV_VCL_N12, RSV_VCL_R13, RSV_VCL_N14, RSV_VCL_R15, RSV_IRAP_VCL22, or RSV_IRAP_VCL23, or in the range of RSV_VCL24..RSV_VCL31, RSV_NVCL41..RSV_NVCL47, or UNSPEC48..UNSPEC63"
"7.4.2.4.5","§7.4.2.4.5","Order of VCL NAL units and association to coded pictures","This subclause specifies the order of VCL NAL units and association to coded pictures. Each VCL NAL unit is part of a coded picture. The order of the VCL NAL units within a coded picture is constrained as follows: -	The first VCL NAL unit of the coded picture shall have first_slice_segment_in_pic_flag equal to 1. -	Let sliceSegAddrA and sliceSegAddrB be the slice_segment_address values of any two coded slice segment NAL units A and B within the same coded picture. When either of the following conditions is true, coded slice segment NAL unit A shall precede the coded slice segment NAL unit B: -	TileId[CtbAddrRsToTs[sliceSegAddrA]] is less than TileId[CtbAddrRsToTs[sliceSegAddrB]]. -	TileId[CtbAddrRsToTs[sliceSegAddrA]] is equal to TileId[CtbAddrRsToTs[sliceSegAddrB]] and CtbAddrRsToTs[sliceSegAddrA] is less than CtbAddrRsToTs[sliceSegAddrB]."
"7.4.3.1","§7.4.3.1","Video parameter set RBSP semantics","NOTE45-VPS NAL units are required to be available to the decoding process prior to their activation (either in the bitstream or by external means), as specified in subclause 7.4.2.4.2. However, the VPS RBSP contains information that is not necessary for operation of the decoding process of this version of this Specification. For purposes other than determining the amount of data in the decoding units of the bitstream (as specified in AnnexC), decoders conforming to this version of this Specification may ignore (remove from the bitstream and discard) the content of all VPS NAL units. Any two instances of the syntax structure hrd_parameters included in a VPS RBSP shall not have the same content. vps_video_parameter_set_id identifies the VPS for reference by other syntax elements. vps_reserved_three_2bits shall be equal to 3 in bitstreams conforming to this version of this Specification. Other values for vps_reserved_three_2bits are reserved for future use by ITU-T | ISO/IEC. Decoders shall ignore the value of vps_reserved_three_2bits. vps_max_layers_minus1 shall be equal to 0 in bitstreams conforming to this version of this Specification. Other values for vps_ max_layers_minus1 are reserved for future use by ITU-T | ISO/IEC. Although the value of vps_max_layers_minus1 is required to be equal to 0 in this version of this Specification, decoders shall allow other values of vps_max_layers_minus1 to appear in the syntax. NOTE46-It is anticipated that in future scalable or 3D video coding extensions of this Specification, this field will be used to specify the maximum number of layers that may be present in the CVS, wherein a layer may e.g. be a spatial scalable layer, a quality scalable layer, a texture view or a depth view. vps_max_sub_layers_minus1 plus 1 specifies the maximum number of temporal sub-layers that may be present in the bitstream. The value of vps_max_sub_layers_minus1 shall be in the range of 0 to 6, inclusive. vps_temporal_id_nesting_flag, when vps_max_sub_layers_minus1 is greater than 0, specifies whether inter prediction is additionally restricted for CVSs referring to the VPS. When vps_max_sub_layers_minus1 is equal to 0, vps_temporal_id_nesting_flag shall be equal to 1. NOTE47-The syntax element vps_temporal_id_nesting_flag is used to indicate that temporal sub-layer up-switching, i.e. switching from decoding of up to any TemporalId tIdN to decoding up to any TemporalId tIdM that is greater than tIdN, is always possible. vps_reserved_0xffff_16bits shall be equal to 0xFFFF in bitstreams conforming to this version of this Specification. Other values for vps_reserved_0xffff_16bits are reserved for future use by ITU-T | ISO/IEC. Decoders shall ignore the value of vps_reserved_0xffff_16bits. NOTE48-It is anticipated that in future scalable or 3D video coding extensions of this Specification, this this syntax element will specify a byte offset to the next set of fixed-length coded information in the VPS RBSP, within the data currently specified as vps_extension_data_flag syntax elements. The byte offset would then help to locate and access such information in the VPS RBSP without the need for performing entropy decoding. vps_sub_layer_ordering_info_present_flag equal to 1 specifies that vps_max_dec_pic_buffering_minus1[i], vps_max_num_reorder_pics[i], and vps_max_latency_increase_plus1[i] are present for vps_max_sub_layers_minus1+1 sub-layers. vps_sub_layer_ordering_info_present_flag equal to 0 specifies that the values of vps_max_dec_pic_buffering_minus1[vps_max_sub_layers_minus1], vps_max_num_reorder_pics[vps_max_sub_layers_minus1], and vps_max_latency_increase_plus1[vps_max_sub_layers_minus1] apply to all sub-layers. vps_max_dec_pic_buffering_minus1[i] plus 1 specifies the maximum required size of the decoded picture buffer for the CVS in units of picture storage buffers when HighestTid is equal to i. The value of vps_max_dec_pic_buffering_minus1[i] shall be in the range of 0 to M"
"7.4.3.2","§7.4.3.2","Sequence parameter set RBSP semantics","sps_video_parameter_set_id specifies the value of the vps_video_parameter_set_id of the active VPS. sps_max_sub_layers_minus1 plus 1 specifies the maximum number of temporal sub-layers that may be present in each CVS referring to the SPS. The value of sps_max_sub_layers_minus1 shall be in the range of 0 to 6, inclusive. sps_temporal_id_nesting_flag, when sps_max_sub_layers_minus1 is greater than 0, specifies whether inter prediction is additionally restricted for CVSs referring to the SPS. When vps_temporal_id_nesting_flag is equal to 1, sps_temporal_id_nesting_flag shall be equal to 1. When sps_max_sub_layers_minus1 is equal to 0, sps_temporal_id_nesting_flag shall be equal to 1. NOTE49-The syntax element sps_temporal_id_nesting_flag is used to indicate that temporal up-switching, i.e. switching from decoding up to any TemporalId tIdN to decoding up to any TemporalId tIdM that is greater than tIdN, is always possible in the CVS. sps_seq_parameter_set_id provides an identifier for the SPS for reference by other syntax elements. The value of sps_seq_parameter_set_id shall be in the range of 0 to 15, inclusive. chroma_format_idc specifies the chroma sampling relative to the luma sampling as specified in subclause6.2. The value of chroma_format_idc shall be in the range of 0 to 3, inclusive. separate_colour_plane_flag equal to 1 specifies that the three colour components of the 4:4:4 chroma format are coded separately. separate_colour_plane_flag equal to 0 specifies that the colour components are not coded separately. When separate_colour_plane_flag is not present, it is inferred to be equal to 0. When separate_colour_plane_flag is equal to 1, the coded picture consists of three separate components, each of which consists of coded samples of one colour plane (Y, Cb, or Cr) and uses the monochrome coding syntax. In this case, each colour plane is associated with a specific colour_plane_id value. NOTE50-There is no dependency in decoding processes between the colour planes having different colour_plane_id values. For example, the decoding process of a monochrome picture with one value of colour_plane_id does not use any data from monochrome pictures having different values of colour_plane_id for inter prediction. Depending on the value of separate_colour_plane_flag, the value of the variable ChromaArrayType is assigned as follows: -	If separate_colour_plane_flag is equal to 0, ChromaArrayType is set equal to chroma_format_idc. -	Otherwise (separate_colour_plane_flag is equal to 1), ChromaArrayType is set equal to 0. pic_width_in_luma_samples specifies the width of each decoded picture in units of luma samples. pic_width_in_luma_samples shall not be equal to 0 and shall be an integer multiple of MinCbSizeY. pic_height_in_luma_samples specifies the height of each decoded picture in units of luma samples. pic_height_in_luma_samples shall not be equal to 0 and shall be an integer multiple of MinCbSizeY. conformance_window_flag equal to 1 indicates that the conformance cropping window offset parameters follow next in the SPS. conformance_window_flag equal to 0 indicates that the conformance cropping window offset parameters are not present. conf_win_left_offset, conf_win_right_offset, conf_win_top_offset, and conf_win_bottom_offset specify the samples of the pictures in the CVS that are output from the decoding process, in terms of a rectangular region specified in picture coordinates for output. When conformance_window_flag is equal to 0, the values of conf_win_left_offset, conf_win_right_offset, conf_win_top_offset, and conf_win_bottom_offset are inferred to be equal to 0. The conformance cropping window contains the luma samples with horizontal picture coordinates from SubWidthC*conf_win_left_offset to pic_width_in_luma_samples?(SubWidthC*conf_win_right_offset+1) and vertical picture coordinates from SubHeightC*conf_win_top_offset to pic_height_in_luma_samples?(SubHeightC*conf_win_bottom_offset+1), inclusiv"
