"id","chapter","title","content"
"0.1","§0.1","General","This clause does not form an integral part of this Recommendation|InternationalStandard."
"0.2","§0.2","Prologue","As the costs for both processing power and memory have reduced, network support for coded video data has diversified, and advances in video coding technology have progressed, the need has arisen for an industry standard for compressed video representation with substantially increased coding efficiency and enhanced robustness to network environments. Toward these ends the ITU-T Video Coding Experts Group (VCEG) and the ISO/IEC Moving Picture Experts Group (MPEG) formed a Joint Collaborative Team on Video Coding (JCT-VC) in 2010 for development of a new Recommendation|InternationalStandard. This Recommendation|InternationalStandard was developed in the JCT-VC."
"0.3","§0.3","Purpose","This Recommendation|InternationalStandard was developed in response to the growing need for higher compression of moving pictures for various applications such as videoconferencing, digital storage media, television broadcasting, internet streaming, and communications. It is also designed to enable the use of the coded video representation in a flexible manner for a wide variety of network environments as well as to enable the use of multi-core parallel encoding and decoding devices. The use of this Recommendation | International Standard allows motion video to be manipulated as a form of computer data and to be stored on various storage media, transmitted and received over existing and future networks and distributed on existing and future broadcasting channels."
"0.4","§0.4","Applications","This Recommendation|InternationalStandard is designed to cover a broad range of applications for video content including but not limited to the following: - Broadcast (cable TV on optical networks / copper, satellite, terrestrial, etc.) - Camcorders - Content production and distribution - Digital cinema - Home cinema - Internet streaming, download and play - Medical imaging - Mobile streaming, broadcast and communications - Real-time conversational services (videoconferencing, videophone, telepresence, etc.) - Remote video surveillance - Storage media (optical disks, digital video tape recorder, etc.) - Wireless display"
"0.5","§0.5","Publication and versions of this Specification","This Specification has been jointly developed by ITU-T Video Coding Experts Group (VCEG) and the ISO/IEC Moving Picture Experts Group (MPEG). It is published as technically-aligned twin text in both ITU-T and ISO/IEC. As the basis text has been drafted to become both an ITU-T Recommendation and an ISO/IEC International Standard, the term ""Specification"" (with capitalization to indicate that it refers to the whole of the text) is used herein when the text refers to itself. This is the first version of this Specification. Additional versions are anticipated."
"0.6","§0.6","Profiles, tiers and levels","This Recommendation|InternationalStandard is designed to be generic in the sense that it serves a wide range of applications, bit rates, resolutions, qualities, and services. Applications should cover, among other things, digital storage media, television broadcasting and real-time communications. In the course of creating this Specification, various requirements from typical applications have been considered, necessary algorithmic elements have been developed, and these have been integrated into a single syntax. Hence, this Specification will facilitate video data interchange among different applications. Considering the practicality of implementing the full syntax of this Specification, however, a limited number of subsets of the syntax are also stipulated by means of ""profiles"", ""tiers"", and ""levels"". These and other related terms are formally defined in clause3. A ""profile"" is a subset of the entire bitstream syntax that is specified in this Recommendation|InternationalStandard. Within the bounds imposed by the syntax of a given profile it is still possible to require a very large variation in the performance of encoders and decoders depending upon the values taken by syntax elements in the bitstream such as the specified size of the decoded pictures. In many applications, it is currently neither practical nor economic to implement a decoder capable of dealing with all hypothetical uses of the syntax within a particular profile. In order to deal with this problem, ""tiers"" and ""levels"" are specified within each profile. A level of a tier is a specified set of constraints imposed on values of the syntax elements in the bitstream. These constraints may be simple limits on values. Alternatively they may take the form of constraints on arithmetic combinations of values (e.g. picture width multiplied by picture height multiplied by number of pictures decoded per second). A level specified for a lower tier is more constrained than a level specified for a higher tier. Coded video content conforming to this Recommendation|InternationalStandard uses a common syntax. In order to achieve a subset of the complete syntax, flags, parameters, and other syntax elements are included in the bitstream that signal the presence or absence of syntactic elements that occur later in the bitstream."
"0.7","§0.7","Overview of the design characteristics","The coded representation specified in the syntax is designed to enable a high compression capability for a desired image or video quality. The algorithm is typically not lossless, as the exact source sample values are typically not preserved through the encoding and decoding processes. A number of techniques may be used to achieve highly efficient compression. Encoding algorithms (not specified in this Recommendation|InternationalStandard) may select between inter and intra coding for block-shaped regions of each picture. Inter coding uses motion vectors for block-based inter prediction to exploit temporal statistical dependencies between different pictures. Intra coding uses various spatial prediction modes to exploit spatial statistical dependencies in the source signal for a single picture. Motion vectors and intra prediction modes may be specified for a variety of block sizes in the picture. The prediction residual may then be further compressed using a transform to remove spatial correlation inside the transform block before it is quantized, producing a possibly irreversible process that typically discards less important visual information while forming a close approximation to the source samples. Finally, the motion vectors or intra prediction modes may also be further compressed using a variety of prediction mechanisms, and, after prediction, are combined with the quantized transform coefficient information and encoded using arithmetic coding."
"0.8","§0.8","How to read this Specification","It is suggested that the reader starts with clause1 (Scope) and moves on to clause3 (Definitions). Clause6 should be read for the geometrical relationship of the source, input, and output of the decoder. Clause7 (Syntax and semantics) specifies the order to parse syntax elements from the bitstream. See subclauses7.1-7.3 for syntactical order and see subclause7.4 for semantics; e.g. the scope, restrictions, and conditions that are imposed on the syntax elements. The actual parsing for most syntax elements is specified in clause9 (Parsing process). Clause10 (Sub-bitstream extraction process) specifies the sub-bitstream extraction process. Finally, clause8 (Decoding process) specifies how the syntax elements are mapped into decoded samples. Throughout reading this Specification, the reader should refer to clauses2 (Normative references), 4 (Abbreviations), and 5 (Conventions) as needed. AnnexesA throughE also form an integral part of this Recommendation | International Standard. AnnexA specifies profiles each being tailored to certain application domains, and defines the so-called tiers and levels of the profiles. AnnexB specifies syntax and semantics of a byte stream format for delivery of coded video as an ordered stream of bytes. AnnexC specifies the hypothetical reference decoder, bitstream conformance, decoder conformance, and the use of the hypothetical reference decoder to check bitstream and decoder conformance. AnnexD specifies syntax and semantics for supplemental enhancement information message payloads. AnnexE specifies syntax and semantics of the video usability information parameters of the sequence parameter set. Throughout this Specification, statements appearing with the preamble ""NOTE -"" are informative and are not an integral part of this Recommendation | International Standard. 1 Scope This document specifies High efficiency video coding. 2 Normative references"
"2.1","§2.1","General","The following Recommendations and International Standards contain provisions which, through reference in this text, constitute provisions of this Recommendation|InternationalStandard. At the time of publication, the editions indicated were valid. All Recommendations and Standards are subject to revision, and parties to agreements based on this Recommendation|InternationalStandard are encouraged to investigate the possibility of applying the most recent edition of the Recommendations and Standards listed below. Members of IEC and ISO maintain registers of currently valid International Standards. The Telecommunication Standardization Bureau of the ITU maintains a list of currently valid ITU-T Recommendations."
"2.4","§2.4","Additional references","-	Rec. ITU-T T.35 (in force), Procedure for the allocation of ITU-T defined codes for non-standard facilities. -	ISO/IEC 11578: in force, Information technology - Open Systems Interconnection - Remote Procedure Call (RPC). -	ISO 11664-1: in force, Colorimetry - Part 1: CIE standard colorimetric observers. -	ISO 12232: in force, Photography - Digital still cameras - Determination of exposure index, ISO speed ratings, standard output sensitivity, and recommended exposure index. -	IETF RFC 1321 (in force), The MD5 Message-Digest Algorithm. 3 Definitions For the purposes of this Recommendation|InternationalStandard, the following definitions apply:"
"3.1","§3.1","access unit: A set of NAL units that are associated with each other according to a specified classification rule, are consecutive in decoding order, and contain exactly one coded picture.","NOTE1-In addition to containing the VCL NAL units of the coded picture, an access unit may also contain non-VCL NAL units. The decoding of an access unit always results in a decoded picture."
"3.15","§3.15","broken link access (BLA) picture: An IRAP picture for which each VCL NAL unit has nal_unit_type equal to BLA_W_LP, BLA_W_RADL, or BLA_N_LP.","NOTE2-A BLA picture contains only I slices, and may be the first picture in the bitstream in decoding order, or may appear later in the bitstream. Each BLA picture begins a new CVS, and has the same effect on the decoding process as an IDR picture. However, a BLA picture contains syntax elements that specify a non-empty RPS. When a BLA picture for which each VCL NAL unit has nal_unit_type equal to BLA_W_LP, it may have associated RASL pictures, which are not output by the decoder and may not be decodable, as they may contain references to pictures that are not present in the bitstream. When a BLA picture for which each VCL NAL unit has nal_unit_type equal to BLA_W_LP, it may also have associated RADL pictures, which are specified to be decoded. When a BLA picture for which each VCL NAL unit has nal_unit_type equal to BLA_W_RADL, it does not have associated RASL pictures but may have associated RADL pictures. When a BLA picture for which each VCL NAL unit has nal_unit_type equal to BLA_N_LP, it does not have any associated leading pictures."
"3.21","§3.21","chroma: An adjective, represented by the symbols Cb and Cr, specifying that a sample array or single sample is representing one of the two colour difference signals related to the primary colours.","NOTE3-The term chroma is used rather than the term chrominance in order to avoid the implication of the use of linear light transfer characteristics that is often associated with the term chrominance."
"3.23","§3.23","clean random access (CRA) picture: An IRAP picture for which each VCL NAL unit has nal_unit_type equal to CRA_NUT.","NOTE4-A CRA picture contains only I slices, and may be the first picture in the bitstream in decoding order, or may appear later in the bitstream. A CRA picture may have associated RADL or RASL pictures. When a CRA picture has NoRaslOutputFlag equal to 1, the associated RASL pictures are not output by the decoder, because they may not be decodable, as they may contain references to pictures that are not present in the bitstream."
"3.28","§3.28","coded video sequence (CVS): A sequence of access units that consists, in decoding order, of an IRAP access unit with NoRaslOutputFlag equal to 1, followed by zero or more access units that are not IRAP access units with NoRaslOutputFlag equal to 1, including all subsequent access units up to but not including any subsequent access unit that is an IRAP access unit with NoRaslOutputFlag equal to 1.","NOTE5-An IRAP access unit may be an IDR access unit, a BLA access unit, or a CRA access unit. The value of NoRaslOutputFlag is equal to 1 for each IDR access unit, each BLA access unit, and each CRA access unit that is the first access unit in the bitstream in decoding order, is the first access unit that follows an end of sequence NAL unit in decoding order, or has HandleCraAsBlaFlag equal to 1."
"3.45","§3.45","elementary stream: A sequence of one or more bitstreams.","NOTE6-An elementary stream that consists of two or more bitstreams would typically have been formed by splicing together two or more bitstreams (or parts thereof)."
"3.59","§3.59","instantaneous decoding refresh (IDR) picture: An IRAP picture for which each VCL NAL unit has nal_unit_type equal to IDR_W_RADL or IDR_N_LP.","NOTE7-An IDR picture contains only I slices, and may be the first picture in the bitstream in decoding order, or may appear later in the bitstream. Each IDR picture is the first picture of a CVS in decoding order. When an IDR picture for which each VCL NAL unit has nal_unit_type equal to IDR_W_RADL, it may have associated RADL pictures. When an IDR picture for which each VCL NAL unit has nal_unit_type equal to IDR_N_LP, it does not have any associated leading pictures. An IDR picture does not have associated RASL pictures."
"3.65","§3.65","intra random access point (IRAP) picture: A coded picture for which each VCL NAL unit has nal_unit_type in the range of BLA_W_LP to RSV_IRAP_VCL23, inclusive.","NOTE8-An IRAP picture contains only I slices, and may be a BLA picture, a CRA picture or an IDR picture. The first picture in the bitstream in decoding order must be an IRAP picture. Provided the necessary parameter sets are available when they need to be activated, the IRAP picture and all subsequent non-RASL pictures in decoding order can be correctly decoded without performing the decoding process of any pictures that precede the IRAP picture in decoding order. There may be pictures in a bitstream that contain only I slices that are not IRAP pictures."
"3.68","§3.68","layer: A set of VCL NAL units that all have a particular value of nuh_layer_id and the associated non-VCL NAL units, or one of a set of syntactical structures having a hierarchical relationship.","NOTE9-Depending on the context, either the first layer concept or the second layer concept applies. The first layer concept is also referred to as a scalable layer, wherein a layer may be a spatial scalable layer, a quality scalable layer, a view, etc. A temporal true subset of a scalable layer is not referred to as a layer but referred to as a sub-layer or temporal sub-layer. The second layer concept is also referred to as a coding layer, wherein higher layers contain lower layers, and the coding layers are the CVS, picture, slice, slice segment, and coding tree unit layers."
"3.73","§3.73","level: A defined set of constraints on the values that may be taken by the syntax elements and variables of this Specification, or the value of a transform coefficient prior to scaling.","NOTE10-The same set of levels is defined for all profiles, with most aspects of the definition of each level being in common across different profiles. Individual implementations may, within the specified constraints, support a different level for each supported profile."
"3.78","§3.78","luma: An adjective, represented by the symbol or subscript Y or L, specifying that a sample array or single sample is representing the monochrome signal related to the primary colours.","NOTE11-The term luma is used rather than the term luminance in order to avoid the implication of the use of linear light transfer characteristics that is often associated with the term luminance. The symbol L is sometimes used instead of the symbol Y to avoid confusion with the symbol y as used for vertical location."
"3.79","§3.79","may: A term that is used to refer to behaviour that is allowed, but not necessarily required.","NOTE12-In some places where the optional nature of the described behaviour is intended to be emphasized, the phrase ""may or may not"" is used to provide emphasis."
"3.86","§3.86","non-reference picture: A picture that is marked as ""unused for reference"".","NOTE13-A non-reference picture contains samples that cannot be used for inter prediction in the decoding process of subsequent pictures in decoding order. In other words, once a picture is marked as ""unused for reference"", it can never be marked back as ""used for reference""."
"3.89","§3.89","operation point: A bitstream created from another bitstream by operation of the sub-bitstream extraction process with the another bitstream, a target highest TemporalId, and a target layer identifier list as inputs.","NOTE14-If the target highest TemporalId of an operation point is equal to the greatest value of TemporalId in the layer set associated with the target layer identification list, the operation point is identical to the layer set. Otherwise it is a subset of the layer set."
"3.93","§3.93","picture: An array of luma samples in monochrome format or an array of luma samples and two corresponding arrays of chroma samples in 4:2:0, 4:2:2, and 4:4:4 colour format.","NOTE15-A picture may be either a frame or a field. However, in one CVS, either all pictures are frames or all pictures are fields."
"3.109","§3.109","random access decodable leading (RADL) picture: A coded picture for which each VCL NAL unit has nal_unit_type equal to RADL_R or RADL_N.","NOTE16-All RADL pictures are leading pictures. RADL pictures are not used as reference pictures for the decoding process of trailing pictures of the same associated IRAP picture. When present, all RADL pictures precede, in decoding order, all trailing pictures of the same associated IRAP picture."
"3.111","§3.111","random access skipped leading (RASL) picture: A coded picture for which each VCL NAL unit has nal_unit_type equal to RASL_R or RASL_N.","NOTE17-All RASL pictures are leading pictures of an associated BLA or CRA picture. When the associated IRAP picture has NoRaslOutputFlag equal to 1, the RASL picture is not output and may not be correctly decodable, as the RASL picture may contain references to pictures that are not present in the bitstream. RASL pictures are not used as reference pictures for the decoding process of non-RASL pictures. When present, all RASL pictures precede, in decoding order, all trailing pictures of the same associated IRAP picture."
"3.117","§3.117","reference picture: A picture that is a short-term reference picture or a long-term reference picture.","NOTE18-A reference picture contains samples that may be used for inter prediction in the decoding process of subsequent pictures in decoding order."
"3.118","§3.118","reference picture list: A list of reference pictures that is used for inter prediction of a P or B slice.","NOTE19-For the decoding process of a P slice, there is one reference picture list - reference picture list 0. For the decoding process of a B slice, there are two reference picture lists - reference picture list 0 and reference picture list1."
"3.121","§3.121","reference picture set (RPS): A set of reference pictures associated with a picture, consisting of all reference pictures that are prior to the associated picture in decoding order, that may be used for inter prediction of the associated picture or any picture following the associated picture in decoding order.","NOTE20-The RPS of a picture consists of five RPS lists, three of which are to contain short-term reference pictures and the other two are to contain long-term reference pictures."
"3.127","§3.127","shall: A term used to express mandatory requirements for conformance to this Specification.","NOTE21-When used to express a mandatory constraint on the values of syntax elements or on the results obtained by operation of the specified decoding process, it is the responsibility of the encoder to ensure that the constraint is fulfilled. When used in reference to operations performed by the decoding process, any decoding process that produces identical cropped decoded pictures to those output from the decoding process described in this Specification conforms to the decoding process requirements of this Specification."
"3.136","§3.136","start code prefix: A unique sequence of three bytes equal to 0x000001 embedded in the byte stream as a prefix to each NAL unit.","NOTE22-The location of a start code prefix can be used by a decoder to identify the beginning of a new NAL unit and the end of a previous NAL unit. Emulation of start code prefixes is prevented within NAL units by the inclusion of emulation prevention bytes."
"3.138","§3.138","step-wise temporal sub-layer access (STSA) picture: A coded picture for which each VCL NAL unit has nal_unit_type equal to STSA_R or STSA_N.","NOTE23-An STSA picture does not use pictures with the same TemporalId as the STSA picture for inter prediction reference. Pictures following an STSA picture in decoding order with the same TemporalId as the STSA picture do not use pictures prior to the STSA picture in decoding order with the same TemporalId as the STSA picture for inter prediction reference. An STSA picture enables up-switching, at the STSA picture, to the sub-layer containing the STSA picture, from the immediately lower sub-layer. STSA pictures must have TemporalId greater than 0."
"3.142","§3.142","sub-layer non-reference picture: A picture that contains samples that cannot be used for inter prediction in the decoding process of subsequent pictures of the same sub-layer in decoding order.","NOTE24-Samples of a sub-layer non-reference picture may be used for inter prediction in the decoding process of subsequent pictures of higher sub-layers in decoding order."
"3.143","§3.143","sub-layer reference picture: A picture that contains samples that may be used for inter prediction in the decoding process of subsequent pictures of the same sub-layer in decoding order.","NOTE25-Samples of a sub-layer reference picture may also be used for inter prediction in the decoding process of subsequent pictures of higher sub-layers in decoding order."
"3.151","§3.151","temporal sub-layer access (TSA) picture: A coded picture for which each VCL NAL unit has nal_unit_type equal to TSA_R or TSA_N.","NOTE26-A TSA picture and pictures following the TSA picture in decoding do not use pictures with TemporalId greater than or equal to that of the TSA picture for inter prediction reference. A TSA picture enables up-switching, at the TSA picture, to the sub-layer containing the TSA picture or any higher sub-layer, from the immediately lower sub-layer. TSA pictures must have TemporalId greater than 0."
"3.158","§3.158","trailing picture: A picture that follows the associated IRAP picture in output order.","NOTE27-Trailing pictures associated with an IRAP picture also follow the IRAP picture in decoding order. Pictures that follow the associated IRAP picture in output order and precede the associated IRAP picture in decoding order are not allowed."
