"id","chapter","title","content"
"8.6.3","§8.6.3","Scaling process for transform coefficients","Inputs to this process are: -	a luma location (xTbY,yTbY) specifying the top-left sample of the current luma transform block relative to the top-left luma sample of the current picture, -	a variable nTbS specifying the size of the current transform block, -	a variable cIdx specifying the colour component of the current block, -	a variable qP specifying the quantization parameter. Output of this process is the (nTbS)x(nTbS) array d of scaled transform coefficients with elements d[x][y]. The variable bdShift is derived as follows: -	If cIdx is equal to 0, bdShift = BitDepthY+Log2(nTbS)?5 (8-363) -	Otherwise, bdShift = BitDepthC+Log2(nTbS)?5 (8-364) The list levelScale is specified as levelScale[k] = {40,45,51,57,64,72} with k=0..5. For the derivation of the scaled transform coefficients d[x][y] with x=0..nTbS?1, y=0..nTbS?1, the following applies: -	The scaling factor m[x][y] is derived as follows: -	If scaling_list_enabled_flag is equal to 0, m[x][y] = 16 (8-365) -	Otherwise (scaling_list_enabled_flag is equal to 1), m[x][y] = ScalingFactor[sizeId][matrixId][x][y]	(8-366) Where sizeId is specified in Table7-5 for the size of the quantization matrix equal to (nTbS)x(nTbS) and matrixId is specified in Table7-6 for sizeId, CuPredMode[xTbY][yTbY], and cIdx, respectively. -	The scaled transform coefficient d[x][y] is derived as follows: d[x][y] = Clip3(?32768,32767,((TransCoeffLevel[xTbY][yTbY][cIdx][x][y]*m[x][y]* levelScale[qP%6]<<(qP/6))+(1<<(bdShift?1)))>>bdShift)	(8-367)"
"8.6.4.1","§8.6.4.1","General","Inputs to this process are: -	a luma location (xTbY,yTbY) specifying the top-left sample of the current luma transform block relative to the top-left luma sample of the current picture, -	a variable nTbS specifying the size of the current transform block, -	a variable cIdx specifying the colour component of the current block, -	an (nTbS)x(nTbS) array d of scaled transform coefficients with elements d[x][y]. Output of this process is the (nTbS)x(nTbS) array r of residual samples with elements r[x][y]. Depending on the values of CuPredMode[xTbY][yTbY], nTbS, and cIdx, the variable trType is derived as follows: -	If CuPredMode[xTbY][yTbY] is equal to MODE_INTRA, nTbS is equal to 4, and cIdx is equal to 0, trType is set equal to 1. -	Otherwise, trType is set equal to 0. The (nTbS)x(nTbS) array r of residual samples is derived as follows: 1. Each (vertical) column of scaled transform coefficients d[x][y] with x=0..nTbS?1, y=0..nTbS?1 is transformed to e[x][y] with x=0..nTbS?1, y=0..nTbS?1 by invoking the one-dimensional transformation process as specified in subclause 8.6.4.2 for each column x=0..nTbS?1 with the size of the transform block nTbS, the list d[x][y] with y=0..nTbS?1, and the transform type variable trType as inputs, and the output is the list e[x][y] with y=0..nTbS?1. 2. The intermediate sample values g[x][y] with x=0..nTbS?1, y=0..nTbS?1 are derived as follows: g[x][y] = Clip3(?32768,32767,(e[x][y]+64)>>7)	(8-368) 3. Each (horizontal) row of the resulting array g[x][y] with x=0..nTbS?1, y=0..nTbS?1 is transformed to r[x][y] with x=0..nTbS?1, y=0..nTbS?1 by invoking the one-dimensional transformation process as specified in subclause 8.6.4.2 for each row y=0..nTbS?1 with the size of the transform block nTbS, the list g[x][y] with x=0..nTbS?1, and the transform type variable trType as inputs, and the output is the list r[x][y] with x=0..nTbS?1."
"8.6.4.2","§8.6.4.2","Transformation process","Inputs to this process are: -	a variable nTbS specifying the sample size of scaled transform coefficients, -	a list of scaled transform coefficients x with elements x[j], with j=0..nTbS?1. -	a transform type variable trType Output of this process is the list of transformed samples y with elements y[i], with i=0..nTbS?1. Depending on the value of trType, the following applies: -	If trType is equal to 1, the following transform matrix multiplication applies: y[i] = with i=0..nTbS?1	(8-369) where the transform coefficient array transMatrix is specified as follows: transMatrix =	(8-370) {29 55 74 84} {74 74 0 ?74} {84 ?29 ?74 55} {55 ?84 74 ?29} -	Otherwise (trType is equal to 0), the following transform matrix multiplication applies: y[i] = with i=0..nTbS?1,	(8-371) where the transform coefficient array transMatrix is specified as follows: transMatrix[m][n] = transMatrixCol0to15[m][n] with m=0..15, n=0...31	(8-372) transMatrixCol0to15 =	(8-373) {64 64 64 64 64 64 64 64 64 64 64 64 64 64 64 64} {90 90 88 85 82 78 73 67 61 54 46 38 31 22 13 4} {90 87 80 70 57 43 25 9 ?9 ?25 ?43 ?57 ?70 ?80 ?87 ?90} {90 82 67 46 22 ?4 ?31 ?54 ?73 ?85 ?90 ?88 ?78 ?61 ?38 ?13} {89 75 50 18 ?18 ?50 ?75 ?89 ?89 ?75 ?50 ?18 18 50 75 89} {88 67 31 ?13 ?54 ?82 ?90 ?78 ?46 ?4 38 73 90 85 61 22} {87 57 9 ?43 ?80 ?90 ?70 ?25 25 70 90 80 43 ?9 ?57 ?87} {85 46 ?13 ?67 ?90 ?73 ?22 38 82 88 54 ?4 ?61 ?90 ?78 ?31} {83 36 ?36 ?83 ?83 ?36 36 83 83 36 ?36 ?83 ?83 ?36 36 83} {82 22 ?54 ?90 ?61 13 78 85 31 ?46 ?90 ?67 4 73 88 38} {80 9 ?70 ?87 ?25 57 90 43 ?43 ?90 ?57 25 87 70 ?9 ?80} {78 ?4 ?82 ?73 13 85 67 ?22 ?88 ?61 31 90 54 ?38 ?90 ?46} {75 ?18 ?89 ?50 50 89 18 ?75 ?75 18 89 50 ?50 ?89 ?18 75} {73 ?31 ?90 ?22 78 67 ?38 ?90 ?13 82 61 ?46 ?88 ?4 85 54} {70 ?43 ?87 9 90 25 ?80 ?57 57 80 ?25 ?90 ?9 87 43 ?70} {67 ?54 ?78 38 85 ?22 ?90 4 90 13 ?88 ?31 82 46 ?73 ?61} {64 ?64 ?64 64 64 ?64 ?64 64 64 ?64 ?64 64 64 ?64 ?64 64} {61 ?73 ?46 82 31 ?88 ?13 90 ?4 ?90 22 85 ?38 ?78 54 67} {57 ?80 ?25 90 ?9 ?87 43 70 ?70 ?43 87 9 ?90 25 80 ?57} {54 ?85 ?4 88 ?46 ?61 82 13 ?90 38 67 ?78 ?22 90 ?31 ?73} {50 ?89 18 75 ?75 ?18 89 ?50 ?50 89 ?18 ?75 75 18 ?89 50} {46 ?90 38 54 ?90 31 61 ?88 22 67 ?85 13 73 ?82 4 78} {43 ?90 57 25 ?87 70 9 ?80 80 ?9 ?70 87 ?25 ?57 90 ?43} {38 ?88 73 ?4 ?67 90 ?46 ?31 85 ?78 13 61 ?90 54 22 ?82} {36 ?83 83 ?36 ?36 83 ?83 36 36 ?83 83 ?36 ?36 83 ?83 36} {31 ?78 90 ?61 4 54 ?88 82 ?38 ?22 73 ?90 67 ?13 ?46 85} {25 ?70 90 ?80 43 9 ?57 87 ?87 57 ?9 ?43 80 ?90 70 ?25} {22 ?61 85 ?90 73 ?38 ?4 46 ?78 90 ?82 54 ?13 ?31 67 ?88} {18 ?50 75 ?89 89 ?75 50 ?18 ?18 50 ?75 89 ?89 75 ?50 18} {13 ?38 61 ?78 88 ?90 85 ?73 54 ?31 4 22 ?46 67 ?82 90} { 9 ?25 43 ?57 70 ?80 87 ?90 90 ?87 80 ?70 57 ?43 25 ?9} { 4 ?13 22 ?31 38 ?46 54 ?61 67 ?73 78 ?82 85 ?88 90 ?90} transMatrix[m][n] = transMatrixCol16to31[m?16][n] with m=16..31, n=0..31,	(8-374) transMatrixCol16to31 = (8-375) { 64 64 64 64 64 64 64 64 64 64 64 64 64 64 64 64} { ?4 ?13 ?22 ?31 ?38 ?46 ?54 ?61 ?67 ?73 ?78 ?82 ?85 ?88 ?90 ?90} {?90 ?87 ?80 ?70 ?57 ?43 ?25 ?9 9 25 43 57 70 80 87 90} { 13 38 61 78 88 90 85 73 54 31 4 ?22 ?46 ?67 ?82 ?90} { 89 75 50 18 ?18 ?50 ?75 ?89 ?89 ?75 ?50 ?18 18 50 75 89} {?22 ?61 ?85 ?90 ?73 ?38 4 46 78 90 82 54 13 ?31 ?67 ?88} {?87 ?57 ?9 43 80 90 70 25 ?25 ?70 ?90 ?80 ?43 9 57 87} { 31 78 90 61 4 ?54 ?88 ?82 ?38 22 73 90 67 13 ?46 ?85} { 83 36 ?36 ?83 ?83 ?36 36 83 83 36 ?36 ?83 ?83 ?36 36 83} {?38 ?88 ?73 ?4 67 90 46 ?31 ?85 ?78 ?13 61 90 54 ?22 ?82} {?80 ?9 70 87 25 ?57 ?90 ?43 43 90 57 ?25 ?87 ?70 9 80} { 46 90 38 ?54 ?90 ?31 61 88 22 ?67 ?85 ?13 73 82 4 ?78"
"8.6.5","§8.6.5","Picture construction process prior to in-loop filter process","Inputs to this process are: -	a location (xCurr,yCurr) specifying the top-left sample of the current block relative to the top-left sample of the current picture component, -	a variable nCurrS specifying the size of the current block, -	a variable cIdx specifying the colour component of the current block, -	an (nCurrS)x(nCurrS) array predSamples specifying the predicted samples of the current block, -	an (nCurrS)x(nCurrS) array resSamples specifying the residual samples of the current block. Depending on the value of the colour component cIdx, the following assignments are made: -	If cIdx is equal to 0, recSamples corresponds to the reconstructed picture sample array SL and the function clipCidx1 corresponds to Clip1Y. -	Otherwise, if cIdx is equal to 1, recSamples corresponds to the reconstructed chroma sample array SCb and the function clipCidx1 corresponds to Clip1C. -	Otherwise (cIdx is equal to 2), recSamples corresponds to the reconstructed chroma sample array SCr and the function clipCidx1 corresponds to Clip1C. The (nCurrS)x(nCurrS) block of the reconstructed sample array recSamples at location (xCurr,yCurr) is derived as follows: recSamples[xCurr+i][yCurr+j] = clipCidx1(predSamples[i][j] + resSamples[i][j])	(8-376) with i=0..nCurrS?1, j=0..nCurrS?1"
"8.7.1","§8.7.1","General","The two in-loop filters, namely deblocking filter and sample adaptive offset filter, are applied as specified by the following ordered steps: 1. For the deblocking filter, the following applies: -	The deblocking filter process as specified in subclause8.7.2 is invoked with the reconstructed picture sample arrays SL, SCb, and SCr as inputs, and the modified reconstructed picture sample arrays S'L, S'Cb, and S'Cr after deblocking as outputs. -	The arrays S'L, S'Cb, S'Cr are assigned to the arrays SL, SCb, SCr (which represent the decoded picture), respectively. 2. When sample_adaptive_offset_enabled_flag is equal to 1, the following applies: -	The sample adaptive offset process as specified in subclause8.7.3 is invoked with the reconstructed picture sample arrays SL, SCb, and SCr as inputs, and the modified reconstructed picture sample arrays S'L, S'Cb, and S'Cr after sample adaptive offset as outputs. -	The arrays S'L, S'Cb, S'Cr are assigned to the arrays SL, SCb, SCr (which represent the decoded picture), respectively."
"8.7.2.1","§8.7.2.1","General","Inputs to this process are the reconstructed picture sample arrays prior to deblocking recPictureL, recPictureCb, and recPictureCr. Outputs of this process are the modified reconstructed picture sample arrays after deblocking recPictureL, recPictureCb, and recPictureCr. The vertical edges in a picture are filtered first. Then the horizontal edges in a picture are filtered with samples modified by the vertical edge filtering process as input. The vertical and horizontal edges in the coding tree blocks of each coding tree unit are processed separately on a coding unit basis. The vertical edges of the coding blocks in a coding unit are filtered starting with the edge on the left-hand side of the coding blocks proceeding through the edges towards the right-hand side of the coding blocks in their geometrical order. The horizontal edges of the coding blocks in a coding unit are filtered starting with the edge on the top of the coding blocks proceeding through the edges towards the bottom of the coding blocks in their geometrical order. NOTE-Although the filtering process is specified on a picture basis in this specification, the filtering process can be implemented on a coding unit basis with an equivalent result, provided the decoder properly accounts for the processing dependency order so as to produce the same output values. The deblocking filter process is applied to all prediction block edges and transform block edges of a picture, except the edges that are at the boundary of the picture, for which the deblocking filter process is disabled by slice_deblocking_filter_disabled_flag, that coincide with tile boundaries when loop_filter_across_tiles_enabled_flag is equal to 0, or that coincide with upper or left slice boundaries of slices with slice_loop_filter_across_slices_enabled_flag equal to 0. For the transform units and prediction units with luma block edges less than 8 samples in either vertical or horizontal direction, only the edges lying on the 8x8 sample grid are filtered. The edge type, vertical or horizontal, is represented by the variable edgeType as specified in Table8-23. Table8-23 - Name of association to edgeType edgeType Name of edgeType 0 (vertical edge) EDGE_VER 1 (horizontal edge) EDGE_HOR When slice_deblocking_filter_disabled_flag of the current slice is equal to 0, for each coding unit with luma coding block size log2CbSize and location of top-left sample of the luma coding block (xCb,yCb), the vertical edges are filtered by the following ordered steps: 1. The luma coding block size nCbS is set equal to 1<<log2CbSize. 2. The variable filterLeftCbEdgeFlag is derived as follows: - If one or more of the following conditions are true, filterLeftCbEdgeFlag is set equal to 0: - The left boundary of the current luma coding block is the left boundary of the picture. - The left boundary of the current luma coding block is the left boundary of the tile and loop_filter_across_tiles_enabled_flag is equal to 0. - The left boundary of the current luma coding block is the left boundary of the slice and slice_loop_filter_across_slices_enabled_flag is equal to 0. - Otherwise, filterLeftCbEdgeFlag is set equal to 1. 3. All elements of the two-dimensional (nCbS)x(nCbS) array verEdgeFlags are initialized to be equal to zero. 4. The derivation process of transform block boundary specified in subclause8.7.2.2 is invoked with the luma location (xCb,yCb), the luma location (xB0,yB0) set equal to (0,0), the transform block size log2TrafoSize set equal to log2CbSize, the variable trafoDepth set equal to 0, the variable filterLeftCbEdgeFlag, the array verEdgeFlags, and the variable edgeType set equal to EDGE_VER as inputs, and the modified array verEdgeFlags as output. 5. The derivation process of prediction block boundary specified in subclause8.7.2.3 is invoked with the luma coding block size log2CbSize, the prediction partition mode PartMode, the array verEdgeFlags, and the variable edgeType set equal to EDGE_"
"8.7.2.2","§8.7.2.2","Derivation process of transform block boundary","Inputs to this process are: -	a luma location (xCb,yCb) specifying the top-left sample of the current luma coding block relative to the top-left luma sample of the current picture, -	a luma location (xB0,yB0) specifying the top-left sample of the current luma block relative to the top-left sample of the current luma coding block, -	a variable log2TrafoSize specifying the size of the current block, -	a variable trafoDepth, -	a variable filterEdgeFlag, -	a two-dimensional (nCbS)x(nCbS) array edgeFlags, -	a variable edgeType specifying whether a vertical (EDGE_VER) or a horizontal (EDGE_HOR) edge is filtered. Output of this process is the modified two-dimensional (nCbS)x(nCbS) array edgeFlags. Depending on the value of split_transform_flag[xCb+xB0][yCb+yB0][trafoDepth], the following applies: -	If split_transform_flag[xCb+xB0][yCb+yB0][trafoDepth] is equal to 1, the following ordered steps apply: 1. The variables xB1 and yB1 are derived as follows: ? The variable xB1 is set equal to xB0+(1<<(log2TrafoSize?1)). ? The variable yB1 is set equal to yB0+(1<<(log2TrafoSize?1)). 2. The derivation process of transform block boundary as specified in this subclause is invoked with the luma location (xCb,yCb), the luma location (xB0,yB0), the variable log2TrafoSize set equal to log2TrafoSize?1, the variable trafoDepth set equal to trafoDepth+1, the variable filterEdgeFlag, the array edgeFlags, and the variable edgeType as inputs, and the output is the modified version of array edgeFlags. 3. The derivation process of transform block boundary as specified in this subclause is invoked with the luma location (xCb,yCb), the luma location (xB1,yB0), the variable log2TrafoSize set equal to log2TrafoSize?1, the variable trafoDepth set equal to trafoDepth+1, the variable filterEdgeFlag, the array edgeFlags, and the variable edgeType as inputs, and the output is the modified version of array edgeFlags. 4. The derivation process of transform block boundary as specified in this subclause is invoked with the luma location (xCb,yCb), the luma location (xB0,yB1), the variable log2TrafoSize set equal to log2TrafoSize?1, the variable trafoDepth set equal to trafoDepth+1, the variable filterEdgeFlag, the array edgeFlags, and the variable edgeType as inputs, and the output is the modified version of array edgeFlags. 5. The derivation process of transform block boundary as specified in this subclause is invoked with the luma location (xCb,yCb), the luma location (xB1,yB1), the variable log2TrafoSize set equal to log2TrafoSize?1, the variable trafoDepth set equal to trafoDepth+1, the variable filterEdgeFlag, the array edgeFlags, and the variable edgeType as inputs, and the output is the modified version of array edgeFlags. -	Otherwise (split_transform_flag[xCb+xB0][yCb+yB0][trafoDepth] is equal to 0), the following applies: - If edgeType is equal to EDGE_VER, the value of edgeFlags[xB0][yB0+k] for k=0..(1<<log2TrafoSize)?1 is derived as follows: - If xB0 is equal to 0, edgeFlags[xB0][yB0+k] is set equal to filterEdgeFlag. - Otherwise, edgeFlags[xB0][yB0+k] is set equal to 1. - Otherwise (edgeType is equal to EDGE_HOR), the value of edgeFlags[xB0+k][yB0] for k=0..(1<<log2TrafoSize)?1 is derived as follows: - If yB0 is equal to 0, edgeFlags[xB0+k][yB0] is set equal to filterEdgeFlag. - Otherwise, edgeFlags[xB0+k][yB0] is set equal to 1."
"8.7.2.3","§8.7.2.3","Derivation process of prediction block boundary","Inputs to this process are: -	a variable log2CbSize specifying the luma coding block size, -	a prediction partition mode PartMode, -	a two-dimensional (nCbS)x(nCbS) array edgeFlags, -	a variable edgeType specifying whether a vertical (EDGE_VER) or a horizontal (EDGE_HOR) edge is filtered. Output of this process is the modified two-dimensional (nCbS)x(nCbS) array edgeFlags. Depending on the values of edgeType and PartMode, the following applies for k=0..(1<<log2CbSize)?1: -	If edgeType is equal to EDGE_VER, the following applies: -	When PartMode is equal to PART_Nx2N or PART_NxN, edgeFlags[1<<(log2CbSize?1)][k] is set equal to 1. -	When PartMode is equal to PART_nLx2N, edgeFlags[1<<(log2CbSize?2)][k] is set equal to 1. -	When PartMode is equal to PART_nRx2N, edgeFlags[3*(1<<(log2CbSize?2))][k] is set equal to 1. -	Otherwise (edgeType is equal to EDGE_HOR), the following applies: -	When PartMode is equal to PART_2NxN or PART_NxN, edgeFlags[k][1<<(log2CbSize?1)] is set equal to 1. -	When PartMode is equal to PART_2NxnU, edgeFlags[k][1<<(log2CbSize?2)] is set equal to 1. -	When PartMode is equal to PART_2NxnD, edgeFlags[k][3*(1<<(log2CbSize?2))] is set equal to 1."
"8.7.2.4","§8.7.2.4","Derivation process of boundary filtering strength","Inputs to this process are: -	a luma picture sample array recPictureL, -	a luma location (xCb,yCb) specifying the top-left sample of the current luma coding block relative to the top-left luma sample of the current picture, -	a variable log2CbSize specifying the size of the current luma coding block, -	a variable edgeType specifying whether a vertical (EDGE_VER) or a horizontal (EDGE_HOR) edge is filtered, -	a two-dimensional (nCbS)x(nCbS) array edgeFlags. Output of this process is a two-dimensional (nCbS)x(nCbS) array bS specifying the boundary filtering strength. The variables xDi, yDj, xN, and yN are derived as follows: - If edgeType is equal to EDGE_VER, xDi is set equal to (i<<3), yDj is set equal to (j<<2), xN is set equal to (1<<(log2CbSize?3))?1, and yN is set equal to (1<<(log2CbSize?2))?1. - Otherwise (edgeType is equal to EDGE_HOR), xDi is set equal to (i<<2), yDj is set equal to (j<<3), xN is set equal to (1<<(log2CbSize?2))?1, and yN is set equal to (1<<(log2CbSize?3))?1. For xDi with i=0..xN and yDj with j=0..yN, the following applies: - If edgeFlags[xDi][yDj] is equal to 0, the variable bS[xDi][yDj] is set equal to 0. - Otherwise (edgeFlags[xDi][yDj] is equal to 1), the following applies: - The sample values p0 and q0 are derived as follows: ? If edgeType is equal to EDGE_VER, p0 is set equal to recPictureL[xCb+xDi?1][yCb+yDj] and q0 is set equal to recPictureL[xCb+xDi][yCb+yDj]. ? Otherwise (edgeType is equal to EDGE_HOR), p0 is set equal to recPictureL[xCb+xDi][yCb+yDj?1] and q0 is set equal to recPictureL[xCb+xDi][yCb+yDj]. - The variable bS[xDi][yDj] is derived as follows: ? If the sample p0 or q0 is in the luma coding block of a coding unit coded with intra prediction mode, bS[xDi][yDj] is set equal to 2. ? Otherwise, if the block edge is also a transform block edge and the sample p0 or q0 is in a luma transform block which contains one or more non-zero transform coefficient levels, bS[xDi][yDj] is set equal to 1. ? Otherwise, if one or more of the following conditions are true, bS[xDi][yDj] is set equal to 1: - For the prediction of the luma prediction block containing the sample p0 different reference pictures or a different number of motion vectors are used than for the prediction of the luma prediction block containing the sample q0. NOTE76-The determination of whether the reference pictures used for the two luma prediction blocks are the same or different is based only on which pictures are referenced, without regard to whether a prediction is formed using an index into reference picture list 0 or an index into reference picture list 1, and also without regard to whether the index position within a reference picture list is different. NOTE77-The number of motion vectors that are used for the prediction of a luma prediction block with top-left luma sample covering (xPb,yPb), is equal to PredFlagL0[xPb][yPb] + PredFlagL1[xPb][yPb]. - One motion vector is used to predict the luma prediction block containing the sample p0 and one motion vector is used to predict the luma prediction block containing the sample q0, and the absolute difference between the horizontal or vertical component of the motion vectors used is greater than or equal to 4 in units of quarter luma samples. - Two motion vectors and two different reference pictures are used to predict the luma prediction block containing the sample p0, two motion vectors for the same two reference pictures are used to predict the luma prediction block containing the sample q0, and the absolute difference between the horizontal or vertical component of the two motion vectors used in the prediction of the two luma prediction blocks for the same reference picture is greater than or equal to 4 in units of quarter luma samples. - Two motion vectors for the same reference picture are used to predict the lu"
"8.7.2.5.1","§8.7.2.5.1","Vertical edge filtering process","Inputs to this process are: -	the picture sample arrays recPictureL, recPictureCb, and recPictureCr, -	a luma location (xCb,yCb) specifying the top-left sample of the current luma coding block relative to the top-left luma sample of the current picture, -	a variable log2CbSize specifying the size of the current luma coding block, -	an array bS specifying the boundary filtering strength. Outputs of this process are the modified picture sample arrays recPictureL, recPictureCb, and recPictureCr. The filtering process for edges in the luma coding block of the current coding unit consists of the following ordered steps: 1. The variable nD is set equal to 1<<(log2CbSize?3). 2. For xDk equal to k<<3 with k=0..nD?1 and yDm equal to m<<2 with m=0..nD*2?1, the following applies: - When bS[xDk][yDm] is greater than 0, the following ordered steps apply: a. The decision process for luma block edges as specified in subclause8.7.2.5.3 is invoked with the luma picture sample array recPictureL, the location of the luma coding block (xCb,yCb), the luma location of the block (xDk,yDm), a variable edgeType set equal to EDGE_VER, and the boundary filtering strength bS[xDk][yDm] as inputs, and the decisions dE, dEp, and dEq, and the variables ? and tC as outputs. b. The filtering process for luma block edges as specified in subclause8.7.2.5.4 is invoked with the luma picture sample array recPictureL, the location of the luma coding block (xCb,yCb), the luma location of the block (xDk,yDm), a variable edgeType set equal to EDGE_VER, the decisions dE, dEp, and dEq, and the variables ? and tC as inputs, and the modified luma picture sample array recPictureL as output. The filtering process for edges in the chroma coding blocks of current coding unit consists of the following ordered steps: 1. The variable nD is set equal to 1<<(log2CbSize?3). 2. For xDk equal to k<<2 with k=0..nD?1 and yDm equal to m<<2 with m=0..nD?1, the following applies: - When bS[xDk*2][yDm*2] is equal to 2 and (((xCb/2+xDk)>>3)<<3) is equal to xCb/2+xDk, the following ordered steps apply: a. The filtering process for chroma block edges as specified in subclause8.7.2.5.5 is invoked with the chroma picture sample array recPictureCb, the location of the chroma coding block (xCb/2,yCb/2), the chroma location of the block (xDk,yDm), a variable edgeType set equal to EDGE_VER, and a variable cQpPicOffset set equal to pps_cb_qp_offset as inputs, and the modified chroma picture sample array recPictureCb as output. b. The filtering process for chroma block edges as specified in subclause8.7.2.5.5 is invoked with the chroma picture sample array recPictureCr, the location of the chroma coding block (xCb/2,yCb/2), the chroma location of the block (xDk,yDm), a variable edgeType set equal to EDGE_VER, and a variable cQpPicOffset set equal to pps_cr_qp_offset as inputs, and the modified chroma picture sample array recPictureCr as output."
